"reference","titre","sous_titre","paragraphe","action_name","action_link","ordre","image"
"introduction","Codeur Academy","Devenez un Expert en Développement Web","Devenez développeur web full-stack. Maîtrisez HTML, CSS, JavaScript, PHP et Laravel grâce à des projets concrets. Formation en ligne avec accompagnement personnalisé d'un expert. ","Démarrez dès maintenant votre carrière !","/formations","1","/Content/CodeurAcademy/images/slider/slide1.jpg"
"pourquoi-choisir-notre-programme","Pourquoi choisir notre programme ?","","Formation complète et flexible. Apprenez à votre rythme avec un tuteur dédié. Accès 24/7 à des ressources pédagogiques variées. Progression garantie grâce à un suivi personnalisé.","Démarrez dès maintenant votre carrière !","/formations","2",""
"déroulement-de-la-formation","Déroulement de la formation ","Apprentissage complet","Vidéos, tutorats, exercices pratiques. Un parcours personnalisé pour maîtriser les concepts clés.","","","4",""
"devenez-développeur-web-du-débutant-au-pro","Devenez développeur web : du débutant au pro !","","Cette formation s'adresse à tous les profils : débutants, reconversions et développeurs confirmés.","","","5",""
"prêt-propulser-votre-carrière","Prêt à propulser votre carrière ?","","Vous acquerrez les compétences recherchées par les entreprises et ouvrirez les portes à de nombreuses opportunités professionnelles. N'attendez plus pour investir dans votre avenir !","","","6",""